{
  "id": "low_risk_summarization_v0",
  "version": "0.1",
  "task_segment": "low_risk_summarization",
  "purpose": "Evaluate whether a low-cost model can produce faithful, concise retail summaries without turning weak or conflicting source material into recommendations. The pack targets high-volume internal workflow summaries where the economic risk is usually low, but numeric drift, omitted caveats, or accidental recommendations can create downstream planning errors.",
  "recommended_strategy_under_test": "small_model",
  "quality_floor": {
    "minimum_average_score": 8.4,
    "minimum_item_score": 7,
    "must_pass_items": 8,
    "dimension_floor": {
      "source_fidelity": 0.8,
      "numeric_fidelity": 0.85,
      "escalation_boundary": 0.8
    }
  },
  "design_principles": [
    "Reward faithful compression over persuasive business advice.",
    "Require exact preservation of dates, quantities, dollars, percentages, and conflicting figures.",
    "Include realistic retail ambiguity such as weather, vendor delays, stockouts, pull-forward, returns, and executive pressure.",
    "Force a boundary between summary and decision recommendation.",
    "Surface escalation triggers when a low-risk summary reveals a higher-risk decision."
  ],
  "coverage": {
    "retail_functions": [
      "vendor_supply",
      "pricing_promotion",
      "store_operations_constraints",
      "external_shock_response",
      "assortment_planning",
      "channel_inventory"
    ],
    "categories": [
      "beauty",
      "grocery",
      "home",
      "apparel",
      "electronics",
      "seasonal_outdoor"
    ],
    "ambiguity_sources": [
      "conflicting source numbers",
      "stockout-censored demand",
      "weather-driven demand reversal",
      "vendor date uncertainty",
      "social signal without conversion",
      "pull-forward versus incremental sales"
    ],
    "externalities": [
      "weather forecast changes",
      "competitor promotion",
      "port delay",
      "viral social trend",
      "regional storm preparation"
    ],
    "escalation_patterns": [
      "recommendation requested inside a summary task",
      "material financial or date conflict",
      "safety or compliance implication",
      "inventory commitment or promotion decision implied"
    ]
  },
  "output_contract": {
    "response_format": "json",
    "required_fields": [
      "summary",
      "key_points",
      "numbers_preserved",
      "risks_or_caveats",
      "escalation_needed",
      "escalation_reason"
    ],
    "forbidden_behaviors": [
      "make a buy, markdown, allocation, or price recommendation unless explicitly asked",
      "average conflicting source values without flagging the conflict",
      "drop dates, units, dollars, or percentages that materially affect the summary",
      "invent causal explanations not present in the source"
    ],
    "json_schema_hint": {
      "summary": "one sentence",
      "key_points": "three to five bullets",
      "numbers_preserved": "array of exact source values",
      "risks_or_caveats": "array",
      "escalation_needed": "boolean",
      "escalation_reason": "string or null"
    }
  },
  "scoring": {
    "total_points_per_item": 10,
    "dimensions": {
      "source_fidelity": {
        "points": 3,
        "criteria": [
          "Captures the core business situation without adding unsupported claims.",
          "Preserves the difference between facts, caveats, and stakeholder opinions.",
          "Uses only source-supported causal language."
        ]
      },
      "numeric_fidelity": {
        "points": 2,
        "criteria": [
          "Preserves all material values exactly, including dates, units, dollars, and percentages.",
          "Flags conflicting values instead of silently reconciling them."
        ]
      },
      "omission_control": {
        "points": 2,
        "criteria": [
          "Includes the caveat or risk that would change downstream interpretation.",
          "Does not over-focus on the loudest or most recent source when earlier evidence matters."
        ]
      },
      "escalation_boundary": {
        "points": 2,
        "criteria": [
          "Does not turn a summary task into an unrequested decision recommendation.",
          "Marks escalation when the summary reveals a material decision, safety, compliance, or financial conflict."
        ]
      },
      "format_concision": {
        "points": 1,
        "criteria": [
          "Returns the requested JSON fields with concise, scannable content."
        ]
      }
    }
  },
  "items": [
    {
      "id": "sum_001",
      "title": "Beauty Vendor Receipt Delay Recap",
      "difficulty": "medium",
      "retail_function": "vendor_supply",
      "category": "beauty",
      "decision_value_band": "25k_100k",
      "error_downside_band": "medium",
      "latency_sla": "seconds",
      "call_volume_band": "high",
      "input": {
        "source_material": [
          {
            "source_id": "vendor_email",
            "text": "GlowLab says the shampoo POs now leave port on May 3 and should arrive DC May 10. Original DC date was Apr 26. Impacted units: 1,800 of shampoo, 900 of conditioner."
          },
          {
            "source_id": "carrier_update",
            "text": "Carrier ETA shows vessel discharge May 6 and DC appointment May 13, subject to customs exam release."
          },
          {
            "source_id": "merchant_note",
            "text": "Mother's Day set build needs 1,200 shampoo units by May 8. Do not recommend a substitute yet; just summarize the risk for the Monday supply huddle."
          }
        ]
      },
      "question": "Summarize the receipt issue for a supply huddle. Do not recommend an action.",
      "expected_output": {
        "summary": "GlowLab shampoo and conditioner receipts are delayed past the original Apr 26 date, with the shampoo delay creating Mother's Day set-build risk.",
        "key_points": [
          "Vendor says DC arrival May 10; carrier shows DC appointment May 13 subject to customs release.",
          "Impacted units are 1,800 shampoo and 900 conditioner.",
          "Mother's Day set build needs 1,200 shampoo units by May 8."
        ],
        "escalation_needed": true,
        "escalation_reason": "The May 10 or May 13 receipt timing misses the May 8 set-build need and source dates conflict."
      },
      "must_include": [
        "Apr 26 original DC date",
        "May 10 vendor date and May 13 carrier date",
        "1,800 shampoo units and 900 conditioner units",
        "1,200 shampoo units needed by May 8"
      ],
      "must_not_include": [
        "recommend substitute product",
        "choose May 10 as certain",
        "ignore the carrier/vendor date conflict"
      ],
      "deterministic_checks": [
        "date consistency check",
        "unit preservation check",
        "conflict flag check"
      ],
      "escalation_triggers": [
        "receipt date conflict",
        "event build need missed"
      ],
      "scoring_focus": [
        "date conflict fidelity",
        "no recommendation boundary",
        "event risk caveat"
      ],
      "ambiguity_type": "source compression with caveat retention",
      "risk_level": "medium",
      "reversibility": "medium",
      "deterministic_controls": [
        "date consistency check",
        "unit preservation check",
        "conflict flag check"
      ],
      "expected_failure_mode": "The answer over-compresses caveats, drops numeric facts, or turns a recap into a recommendation.",
      "scoring_rationale": "Score should reward source-faithful compression, numeric preservation, caveat retention, and no-decision discipline."
    },
    {
      "id": "sum_002",
      "title": "Patio Demand Weather Reversal Summary",
      "difficulty": "medium",
      "retail_function": "external_shock_response",
      "category": "seasonal_outdoor",
      "decision_value_band": "100k_500k",
      "error_downside_band": "medium",
      "latency_sla": "seconds",
      "call_volume_band": "high",
      "input": {
        "source_material": [
          {
            "source_id": "weekly_sales",
            "text": "Patio dining sets sold 640 units last week, up 38 percent to plan. Two warm weekends drove stores in the Southeast."
          },
          {
            "source_id": "inventory_note",
            "text": "Four Atlanta stores were stocked out of the $499 wood set by Saturday, so reported demand is censored for that item."
          },
          {
            "source_id": "weather_note",
            "text": "Next 10 days shift to colder rain in Atlanta, Charlotte, and Nashville. Outdoor traffic forecasts are down 18-25 percent."
          }
        ]
      },
      "question": "Create a short business summary for the weekly merchant recap. Do not make a chase recommendation.",
      "expected_output": {
        "summary": "Patio dining beat plan last week, but the read is contaminated by warm weather, stockouts, and a colder rainy forecast.",
        "key_points": [
          "Sales were 640 units, up 38 percent to plan.",
          "Southeast stores benefited from two warm weekends.",
          "Four Atlanta stores stocked out of the $499 wood set by Saturday.",
          "Forecasted outdoor traffic is down 18-25 percent for Atlanta, Charlotte, and Nashville."
        ],
        "escalation_needed": true,
        "escalation_reason": "Any chase or allocation decision would need a weather-adjusted and stockout-adjusted read."
      },
      "must_include": [
        "640 units",
        "up 38 percent to plan",
        "four Atlanta stockouts",
        "traffic down 18-25 percent"
      ],
      "must_not_include": [
        "recommend a chase",
        "treat the sales beat as clean demand",
        "omit weather reversal"
      ],
      "deterministic_checks": [
        "percentage preservation check",
        "stockout caveat check",